[
  {
    "moduleId": "operatoros",
    "slug": "operatoros",
    "displayName": "OperatorOS",
    "clientId": "operatoros:web",
    "entitlementKey": "operatoros",
    "productionBaseUrl": "https://operatoros.net",
    "stagingBaseUrl": null,
    "exactRedirectUris": ["https://operatoros.net/sso", "https://app.operatoros.net/sso"],
    "exactLogoutUris": ["https://operatoros.net/logout", "https://app.operatoros.net/logout"],
    "exactAllowedOrigins": ["https://operatoros.net", "https://app.operatoros.net", "https://auth.operatoros.net"],
    "callbackPath": "/sso",
    "launchPath": "/app",
    "healthCheckPath": "/healthz",
    "enabled": true,
    "environment": "production",
    "contractVersion": "v1",
    "minimumAuthAdapterVersion": "1.0.0",
    "icon": "operatoros",
    "owner": "Shotgun Ninjas Productions"
  },
  {
    "moduleId": "tradeflowkit",
    "slug": "tradeflowkit",
    "displayName": "TradeFlowKit",
    "clientId": "operatoros:tradeflowkit",
    "entitlementKey": "tradeflowkit",
    "productionBaseUrl": "https://tradeflowkit.operatoros.net",
    "stagingBaseUrl": null,
    "exactRedirectUris": ["https://tradeflowkit.operatoros.net/sso"],
    "exactLogoutUris": ["https://tradeflowkit.operatoros.net/logout"],
    "exactAllowedOrigins": ["https://tradeflowkit.operatoros.net"],
    "callbackPath": "/sso",
    "launchPath": "/dashboard",
    "healthCheckPath": "/healthz",
    "enabled": true,
    "environment": "production",
    "contractVersion": "v1",
    "minimumAuthAdapterVersion": "1.0.0",
    "icon": "tradeflowkit",
    "owner": "Shotgun Ninjas Productions"
  },
  {
    "moduleId": "torqueshed",
    "slug": "torqueshed",
    "displayName": "TorqueShed",
    "clientId": "operatoros:torqueshed",
    "entitlementKey": "torqueshed",
    "productionBaseUrl": "https://torqueshed.operatoros.net",
    "stagingBaseUrl": null,
    "exactRedirectUris": ["https://torqueshed.operatoros.net/sso"],
    "exactLogoutUris": ["https://torqueshed.operatoros.net/logout"],
    "exactAllowedOrigins": ["https://torqueshed.operatoros.net"],
    "callbackPath": "/sso",
    "launchPath": "/",
    "healthCheckPath": "/healthz",
    "enabled": true,
    "environment": "production",
    "contractVersion": "v1",
    "minimumAuthAdapterVersion": "1.0.0",
    "icon": "torqueshed",
    "owner": "Shotgun Ninjas Productions"
  },
  {
    "moduleId": "techdeck",
    "slug": "techdeck",
    "displayName": "TechDeck",
    "clientId": "operatoros:techdeck",
    "entitlementKey": "techdeck",
    "productionBaseUrl": "https://techdeck.operatoros.net",
    "stagingBaseUrl": null,
    "exactRedirectUris": ["https://techdeck.operatoros.net/sso"],
    "exactLogoutUris": ["https://techdeck.operatoros.net/logout"],
    "exactAllowedOrigins": ["https://techdeck.operatoros.net"],
    "callbackPath": "/sso",
    "launchPath": "/",
    "healthCheckPath": "/healthz",
    "enabled": true,
    "environment": "production",
    "contractVersion": "v1",
    "minimumAuthAdapterVersion": "1.0.0",
    "icon": "techdeck",
    "owner": "Shotgun Ninjas Productions"
  },
  {
    "moduleId": "pulsedesk",
    "slug": "pulsedesk",
    "displayName": "PulseDesk",
    "clientId": "operatoros:pulsedesk",
    "entitlementKey": "pulsedesk",
    "productionBaseUrl": "https://pulsedesk.operatoros.net",
    "stagingBaseUrl": null,
    "exactRedirectUris": ["https://pulsedesk.operatoros.net/sso"],
    "exactLogoutUris": ["https://pulsedesk.operatoros.net/logout"],
    "exactAllowedOrigins": ["https://pulsedesk.operatoros.net"],
    "callbackPath": "/sso",
    "launchPath": "/dashboard",
    "healthCheckPath": "/healthz",
    "enabled": true,
    "environment": "production",
    "contractVersion": "v1",
    "minimumAuthAdapterVersion": "1.0.0",
    "icon": "pulsedesk",
    "owner": "Shotgun Ninjas Productions"
  },
  {
    "moduleId": "faultlinelab",
    "slug": "faultlinelab",
    "displayName": "FaultlineLab",
    "clientId": "operatoros:faultlinelab",
    "entitlementKey": "faultlinelab",
    "productionBaseUrl": "https://faultlinelab.operatoros.net",
    "stagingBaseUrl": null,
    "exactRedirectUris": ["https://faultlinelab.operatoros.net/sso"],
    "exactLogoutUris": ["https://faultlinelab.operatoros.net/logout"],
    "exactAllowedOrigins": ["https://faultlinelab.operatoros.net"],
    "callbackPath": "/sso",
    "launchPath": "/",
    "healthCheckPath": "/healthz",
    "enabled": true,
    "environment": "production",
    "contractVersion": "v1",
    "minimumAuthAdapterVersion": "1.0.0",
    "icon": "faultlinelab",
    "owner": "Shotgun Ninjas Productions"
  },
  {
    "moduleId": "ninja-pool-hall",
    "slug": "ninja-pool-hall",
    "displayName": "Operator Pool Hall",
    "clientId": "operatoros:ninja-pool-hall",
    "entitlementKey": "ninja-pool-hall",
    "productionBaseUrl": "https://operatorpoolhall.operatoros.net",
    "stagingBaseUrl": null,
    "exactRedirectUris": ["https://operatorpoolhall.operatoros.net/sso"],
    "exactLogoutUris": ["https://operatorpoolhall.operatoros.net/logout"],
    "exactAllowedOrigins": ["https://operatorpoolhall.operatoros.net"],
    "callbackPath": "/sso",
    "launchPath": "/",
    "healthCheckPath": "/healthz",
    "enabled": true,
    "environment": "production",
    "contractVersion": "v1",
    "minimumAuthAdapterVersion": "1.0.0",
    "icon": "ninja-pool-hall",
    "owner": "Shotgun Ninjas Productions"
  },
  {
    "moduleId": "brandforgeos",
    "slug": "brandforgeos",
    "displayName": "BrandForgeOS",
    "clientId": "operatoros:brandforgeos",
    "entitlementKey": "brandforgeos",
    "productionBaseUrl": "https://brandforgeos.operatoros.net",
    "stagingBaseUrl": null,
    "exactRedirectUris": ["https://brandforgeos.operatoros.net/sso"],
    "exactLogoutUris": ["https://brandforgeos.operatoros.net/logout"],
    "exactAllowedOrigins": ["https://brandforgeos.operatoros.net"],
    "callbackPath": "/sso",
    "launchPath": "/",
    "healthCheckPath": "/healthz",
    "enabled": true,
    "environment": "production",
    "contractVersion": "v1",
    "minimumAuthAdapterVersion": "1.0.0",
    "icon": "brandforgeos",
    "owner": "Shotgun Ninjas Productions"
  },
  {
    "moduleId": "snapproofos",
    "slug": "snapproofos",
    "displayName": "SnapProofOS",
    "clientId": "operatoros:snapproofos",
    "entitlementKey": "snapproofos",
    "productionBaseUrl": "https://snapproofos.operatoros.net",
    "stagingBaseUrl": null,
    "exactRedirectUris": ["https://snapproofos.operatoros.net/sso"],
    "exactLogoutUris": ["https://snapproofos.operatoros.net/logout"],
    "exactAllowedOrigins": ["https://snapproofos.operatoros.net"],
    "callbackPath": "/sso",
    "launchPath": "/",
    "healthCheckPath": "/healthz",
    "enabled": true,
    "environment": "production",
    "contractVersion": "v1",
    "minimumAuthAdapterVersion": "1.0.0",
    "icon": "snapproofos",
    "owner": "Shotgun Ninjas Productions"
  },
  {
    "moduleId": "studyforge-ai",
    "slug": "studyforge-ai",
    "displayName": "StudyForge AI",
    "clientId": "operatoros:studyforge-ai",
    "entitlementKey": "studyforge-ai",
    "productionBaseUrl": "https://studyforge-ai.operatoros.net",
    "stagingBaseUrl": null,
    "exactRedirectUris": ["https://studyforge-ai.operatoros.net/sso"],
    "exactLogoutUris": ["https://studyforge-ai.operatoros.net/logout"],
    "exactAllowedOrigins": ["https://studyforge-ai.operatoros.net"],
    "callbackPath": "/sso",
    "launchPath": "/",
    "healthCheckPath": "/healthz",
    "enabled": true,
    "environment": "production",
    "contractVersion": "v1",
    "minimumAuthAdapterVersion": "1.0.0",
    "icon": "studyforge-ai",
    "owner": "Shotgun Ninjas Productions"
  },
  {
    "moduleId": "ninja-launch-kit",
    "slug": "ninja-launch-kit",
    "displayName": "Deploy Ops",
    "clientId": "operatoros:ninja-launch-kit",
    "entitlementKey": "ninja-launch-kit",
    "productionBaseUrl": "https://deployops.operatoros.net",
    "stagingBaseUrl": null,
    "exactRedirectUris": ["https://deployops.operatoros.net/sso"],
    "exactLogoutUris": ["https://deployops.operatoros.net/logout"],
    "exactAllowedOrigins": ["https://deployops.operatoros.net"],
    "callbackPath": "/sso",
    "launchPath": "/dashboard",
    "healthCheckPath": "/healthz",
    "enabled": true,
    "environment": "production",
    "contractVersion": "v1",
    "minimumAuthAdapterVersion": "1.0.0",
    "icon": "ninja-launch-kit",
    "owner": "Shotgun Ninjas Productions"
  },
  {
    "moduleId": "callcommand-ai",
    "slug": "callcommand-ai",
    "displayName": "CallCommand AI",
    "clientId": "operatoros:callcommand-ai",
    "entitlementKey": "callcommand-ai",
    "productionBaseUrl": "https://callcommand-ai.operatoros.net",
    "stagingBaseUrl": null,
    "exactRedirectUris": ["https://callcommand-ai.operatoros.net/sso"],
    "exactLogoutUris": ["https://callcommand-ai.operatoros.net/logout"],
    "exactAllowedOrigins": ["https://callcommand-ai.operatoros.net"],
    "callbackPath": "/sso",
    "launchPath": "/",
    "healthCheckPath": "/healthz",
    "enabled": true,
    "environment": "production",
    "contractVersion": "v1",
    "minimumAuthAdapterVersion": "1.0.0",
    "icon": "callcommand-ai",
    "owner": "Shotgun Ninjas Productions"
  },
  {
    "moduleId": "ninjamation",
    "slug": "ninjamation",
    "displayName": "Script Ops",
    "clientId": "operatoros:ninjamation",
    "entitlementKey": "ninjamation",
    "productionBaseUrl": "https://scriptops.operatoros.net",
    "stagingBaseUrl": null,
    "exactRedirectUris": ["https://scriptops.operatoros.net/sso"],
    "exactLogoutUris": ["https://scriptops.operatoros.net/logout"],
    "exactAllowedOrigins": ["https://scriptops.operatoros.net"],
    "callbackPath": "/sso",
    "launchPath": "/library",
    "healthCheckPath": "/healthz",
    "enabled": true,
    "environment": "production",
    "contractVersion": "v1",
    "minimumAuthAdapterVersion": "1.0.0",
    "icon": "ninjamation",